{
  "change_id": "CR-0002",
  "spec_version": "0.2.0",
  "change_type": "spec_only",
  "requirement_ids": [
    "PRD-USER-001",
    "PRD-FLOW-001",
    "PRD-SCOPE-001",
    "FR-INGEST-001",
    "FR-INGEST-002",
    "FR-INGEST-003",
    "FR-INGEST-004",
    "FR-PARSE-001",
    "FR-PARSE-002",
    "FR-PARSE-003",
    "FR-PARSE-004",
    "FR-PARSE-005",
    "FR-PARSE-006",
    "FR-DATA-001",
    "FR-CLASS-001",
    "FR-REVISION-001",
    "FR-REVISION-002",
    "FR-REVISION-003",
    "FR-REQ-001",
    "FR-ROUTE-001",
    "FR-MATERIAL-001",
    "FR-MATERIAL-002",
    "FR-MATERIAL-003",
    "FR-MATERIAL-004",
    "FR-MATERIAL-005",
    "FR-TAKEOFF-001",
    "FR-TAKEOFF-002",
    "FR-TAKEOFF-003",
    "FR-INSPECTION-001",
    "FR-INSPECTION-002",
    "FR-INSPECTION-003",
    "FR-CONFLICT-001",
    "FR-CONFLICT-002",
    "FR-CONFLICT-003",
    "FR-MISSING-001",
    "FR-EVIDENCE-001",
    "FR-COVERAGE-001",
    "FR-REVIEW-001",
    "FR-REVIEW-002",
    "FR-EXPORT-001",
    "FR-UI-001",
    "FR-API-001",
    "FR-API-002",
    "FR-API-003",
    "FR-API-004",
    "FR-API-005",
    "FR-PROMPT-001",
    "FR-MODEL-001",
    "NFR-SECURITY-001",
    "NFR-SECURITY-002",
    "NFR-SECURITY-003",
    "NFR-RELIABILITY-001",
    "NFR-OBS-001",
    "QLT-EVAL-001",
    "QLT-EVAL-002",
    "DEV-SPEC-001",
    "DEV-SPEC-002",
    "DEV-SPEC-003",
    "DEV-SPEC-004",
    "FR-REVISION-004",
    "PRD-PROTOTYPE-001",
    "PRD-RESP-001",
    "FR-OPTIONS-001",
    "FR-INSTANCE-001",
    "FR-FIELD-EVIDENCE-001",
    "FR-SCHEMA-001",
    "FR-COVERAGE-002",
    "FR-CONTEXT-001",
    "FR-ROUTE-002",
    "FR-ROUTE-003",
    "FR-ROUTE-004",
    "FR-TOKEN-001",
    "FR-TOKEN-002",
    "FR-TOKEN-003",
    "FR-VISION-001",
    "FR-CAPABILITY-001",
    "FR-BUDGET-001",
    "FR-BUDGET-002",
    "FR-BUDGET-003",
    "FR-BUDGET-004",
    "FR-DEADLINE-001",
    "FR-REVIEW-003",
    "FR-ASSEMBLY-001",
    "FR-INPUT-STATUS-001",
    "FR-TESTING-001",
    "DEV-APPROVAL-001",
    "DEV-LOWCOST-001",
    "DEV-TRACE-001",
    "DEV-CHANGE-001",
    "DEV-CHECK-001"
  ],
  "summary": "依据用户澄清修订v0.2规格，加入最低成本路由与离线契约，不实现产品应用。",
  "decision_refs": [
    "docs/DECISIONS.md#D-01至D-16",
    "本轮用户“在此基础上，开始生成”"
  ],
  "affected_paths": [
    "docs/**",
    "spec/**",
    "config/**",
    "prompts/**",
    "contracts/**",
    "tests/**",
    "scripts/**",
    ".github/**",
    "AGENTS.md",
    "README.md",
    "CHANGELOG.md",
    "VERSION",
    "baseline/**",
    "examples/**",
    "requirements-dev.txt",
    "pytest.ini",
    ".env.example",
    ".gitignore"
  ],
  "tests": [
    "tests/test_contracts.py",
    "tests/test_policies.py",
    "tests/test_governance.py"
  ],
  "product_implementation_changed": false,
  "approval_evidence": "用户本轮已授权生成修订规格；本字段不代替未来PR的人类审批。",
  "known_limitations": [
    "原型应用未实现",
    "真实API未调用",
    "图纸质量未测",
    "预算参考为单进程内存，不是生产持久化账务"
  ]
}
